@@,concept,name,concept_type,domain,indicator_url,color,scales,drill_up,unit,interpolation,description,tags
->,agriculture_percent_of_gdp,Agriculture,measure,,https://docs.google.com/spreadsheet/pub?key=0AkBd6lyS3EmpdFhPbDdCTTYxM1dGc21UdE9sSkp1WEE,,"[""linear"", ""log""]",,"% of GDP",,"Agriculture includes forestry, hunting, and fishing, as well as cultivation of crops and livestock production. Value added is the net output of a sector after adding up all outputs and subtracting intermediate inputs. It is calculated without making deductions for depreciation of fabricated assets or depletion and degradation of natural resources.->Agriculture corresponds to ISIC divisions 1-5 and includes forestry, hunting, and fishing, as well as cultivation of crops and livestock production. Value added is the net output of a sector after adding up all outputs and subtracting intermediate inputs. It is calculated without making deductions for depreciation of fabricated assets or depletion and degradation of natural resources. The origin of value added is determined by the International Standard Industrial Classification (ISIC), revision 3. Note: For VAB countries, gross value added at factor cost is used as the denominator.",sectors
->,industry_percent_of_gdp,Industry,measure,,https://docs.google.com/spreadsheet/pub?key=0AkBd6lyS3EmpdHA2UEFOYTlUTWtzV29xbHFuMU00SFE,,"[""linear"", ""log""]",,"% of GDP",,"Industry comprises value added in mining, manufacturing (also reported as a separate subgroup), construction, electricity, water, and gas. Value added is the net output of a sector after adding up all outputs and subtracting intermediate inputs. It is calculated without making deductions for depreciation of fabricated assets or depletion and degradation of natural resources. ->Industry corresponds to ISIC divisions 10-45 and includes manufacturing (ISIC divisions 15-37). It comprises value added in mining, manufacturing (also reported as a separate subgroup), construction, electricity, water, and gas. Value added is the net output of a sector after adding up all outputs and subtracting intermediate inputs. It is calculated without making deductions for depreciation of fabricated assets or depletion and degradation of natural resources. The origin of value added is determined by the International Standard Industrial Classification (ISIC), revision 3. Note: For VAB countries, gross value added at factor cost is used as the denominator.",sectors
->,services_percent_of_gdp,Services,measure,,https://docs.google.com/spreadsheet/pub?key=0AkBd6lyS3EmpdHk4eXd4RG5Rb1gtUTB0cUJ3M21qdGc,,"[""linear"", ""log""]",,"% of GDP",,"Services include wholesale and retail trade (including hotels and restaurants), transport, and government, financial, professional, and personal services such as education, health care, and real estate services. Also included are imputed bank service charges, import duties, and any statistical discrepancies noted by national compilers as well as discrepancies arising from rescaling. ->Services correspond to ISIC divisions 50-99 and they include value added in wholesale and retail trade (including hotels and restaurants), transport, and government, financial, professional, and personal services such as education, health care, and real estate services. Also included are imputed bank service charges, import duties, and any statistical discrepancies noted by national compilers as well as discrepancies arising from rescaling. Value added is the net output of a sector after adding up all outputs and subtracting intermediate inputs. It is calculated without making deductions for depreciation of fabricated assets or depletion and degradation of natural resources. The industrial origin of value added is determined by the International Standard Industrial Classification (ISIC), revision 3. Note: For VAB countries, gross value added at factor cost is used as the denominator.",sectors
->,exports_percent_of_gdp,Exports,measure,,https://docs.google.com/spreadsheet/pub?key=0AkBd6lyS3EmpdHZSTVMxaVdxQlFLR3NMbnBEWnVuTXc,,"[""linear"", ""log""]",,"% of GDP",,"Exports of goods and services represent the value of all goods and other market services provided to the rest of the world. They include the value of merchandise, freight, insurance, transport, travel, royalties, license fees, and other services, such as communication, construction, financial, information, business, personal, and government services. They exclude labor and property income (formerly called factor services) as well as transfer payments.->Exports of goods and services represent the value of all goods and other market services provided to the rest of the world. They include the value of merchandise, freight, insurance, transport, travel, royalties, license fees, and other services, such as communication, construction, financial, information, business, personal, and government services. They exclude compensation of employees and investment income (formerly called factor services) and transfer payments.",debt_trade
->,imports_percent_of_gdp,Imports,measure,,https://docs.google.com/spreadsheet/pub?key=0AkBd6lyS3EmpdEhLMVdnUjZ0d05WWkhjT0FjSDIwQmc,,"[""linear"", ""log""]",,"% of GDP",,"Imports of goods and services represent the value of all goods and other market services received from the rest of the world. They include the value of merchandise, freight, insurance, transport, travel, royalties, license fees, and other services, such as communication, construction, financial, information, business, personal, and government services. They exclude labor and property income (formerly called factor services) as well as transfer payments. ->Imports of goods and services represent the value of all goods and other market services received from the rest of the world. They include the value of merchandise, freight, insurance, transport, travel, royalties, license fees, and other services, such as communication, construction, financial, information, business, personal, and government services. They exclude compensation of employees and investment income (formerly called factor services) and transfer payments.",debt_trade
->,arms_exports_us_inflation_adjusted,"Arms exports",measure,,https://docs.google.com/spreadsheet/pub?key=0AkBd6lyS3EmpdGpkU3BSVmw5UXhTMWd6UFc1eXI3Rnc,,"[""linear"", ""log""]",,$,,"Data for some countries are based on partial or uncertain data or rough estimates. Arms transfers cover the supply of military weapons through sales, aid, gifts, and those made through manufacturing licenses. Data cover major conventional weapons such as aircraft, armored vehicles, artillery, radar systems, missiles, and ships designed for military use. Excluded are transfers of other military equipment such as small arms and light weapons, trucks, small artillery, ammunition, support equipment, technology transfers, and other services. In 1990 prices.->Arms transfers cover the supply of military weapons through sales, aid, gifts, and those made through manufacturing licenses. Data cover major conventional weapons such as aircraft, armored vehicles, artillery, radar systems, missiles, and ships designed for military use. Excluded are transfers of other military equipment such as small arms and light weapons, trucks, small artillery, ammunition, support equipment, technology transfers, and other services.",debt_trade
->,arms_imports_us_inflation_adjusted,"Arms imports",measure,,https://docs.google.com/spreadsheet/pub?key=0AkBd6lyS3EmpdEljeENrOXlFXzR3Rm8xT0drTV9YclE,,"[""linear"", ""log""]",,$,,"Data for some countries are based on partial or uncertain data or rough estimates. Arms transfers cover the supply of military weapons through sales, aid, gifts, and those made through manufacturing licenses. Data cover major conventional weapons such as aircraft, armored vehicles, artillery, radar systems, missiles, and ships designed for military use. Excluded are transfers of other military equipment such as small arms and light weapons, trucks, small artillery, ammunition, support equipment, technology transfers, and other services.In 1990 prices,->Arms transfers cover the supply of military weapons through sales, aid, gifts, and those made through manufacturing licenses. Data cover major conventional weapons such as aircraft, armored vehicles, artillery, radar systems, missiles, and ships designed for military use. Excluded are transfers of other military equipment such as small arms and light weapons, trucks, small artillery, ammunition, support equipment, technology transfers, and other services.",debt_trade
,total_gdp_ppp_inflation_adjusted,"Total GDP, PPP",measure,,https://spreadsheets.google.com/pub?key=0Asm_G8nr4TCSdDh2NWQtVDJhYlVsTElFRjJIYkNlSnc,,"[""log"", ""linear""]",,$,,"PPP GDP is gross domestic product converted to international dollars using purchasing power parity rates. A PPP dollar has the same purchasing power over GDP as the U.S. dollar has in the United States. Data are in constant 2005 international dollars.",incomes_growth
,high_technology_exports_percent_of_manufactured_exports,"High-technology exports",measure,,https://docs.google.com/spreadsheet/pub?key=0AkBd6lyS3EmpdEZkTFJZR2RNMVFuRmUzbktyTkoxREE,,"[""linear"", ""log""]",,"% of manufactured exports",,"High-technology exports are products with high R&D intensity, such as in aerospace, computers, pharmaceuticals, scientific instruments, and electrical machinery.",debt_trade
->,merchandise_trade_percent_of_gdp,"Merchandise trade",measure,,https://docs.google.com/spreadsheet/pub?key=0AkBd6lyS3EmpdDJFSzRHa3g1Q29BOWlla0tTOEFyVGc,,"[""linear"", ""log""]",,"% of GDP",,"Merchandise trade as a share of GDP is the sum of merchandise exports and imports divided by the value of GDP, all in current U. S. dollars. ->Merchandise trade as a share of GDP is the sum of merchandise exports and imports divided by the value of GDP, all in current U.S. dollars.",debt_trade
->,trade_balance_us_not_inflation_adjusted,"Trade balance",measure,,https://docs.google.com/spreadsheet/pub?key=0AkBd6lyS3EmpdEF6VzlKTzNCNjRnT0ZzMDg5a1d1Z3c,,"[""linear"", ""log""]",,"$, not infl.-adjusted",,"The value of exports of goods and services minus the value of imports of goods and services. Measured in US$.->External balance on goods and services (formerly resource balance) equals exports of goods and services minus imports of goods and services (previously nonfactor services). Data are in current U.S. dollars.",debt_trade
,trade_balance_percent_of_gdp,"Trade balance share of GDP",measure,,https://docs.google.com/spreadsheet/pub?key=0AkBd6lyS3EmpdFpGU185SkpmZ2V4ajNPZHFaaEwtU1E,,"[""linear"", ""log""]",,%,,"External balance on goods and services (formerly resource balance) equals exports of goods and services minus imports of goods and services (previously nonfactor services).",debt_trade
...,...,...,...,...,...,...,...,...,...,...,...,...
,working_hours_per_week,"Working hours",measure,,http://spreadsheets.google.com/pub?key=rdCufG2vozTpKw7TBGbyoWw,,"[""linear"", ""log""]",,"per week",,"Total amount of yearly working hours devided by 52 weeks.",economic_situation
->,market_value_of_listed_companies_percent_of_gdp,"Market value of listed companies",measure,,http://spreadsheets.google.com/pub?key=pyj6tScZqmEfMkeuokDLVIQ,,"[""linear"", ""log""]",,"% of GDP",,"Market capitalization (also known as market value) is the share price times the number of shares outstanding. Listed domestic companies are the domestically incorporated companies listed on the country's stock exchanges at the end of the year. Listed companies does not include investment companies, mutual funds, or other collective investment vehicles.->Market capitalization (also known as market value) is the share price times the number of shares outstanding (including their several classes) for listed domestic companies. Investment funds, unit trusts, and companies whose only business goal is to hold shares of other listed companies are excluded. Data are end of year values.",economic_situation
->,military_expenditure_percent_of_gdp,"Military expenditure",measure,,https://docs.google.com/spreadsheet/pub?key=0AkBd6lyS3EmpdDNPQjFBT2s5Zko3U2V0NFQzS3owRnc,,"[""linear"", ""log""]",,"% of GDP",,"Data, from SIPRI, are derived from the NATO definition, which includes all current and capital expenditures on the armed forces, including peacekeeping forces; defense ministries and other government agencies engaged in defense projects; paramilitary forces, if these are judged to be trained and equipped for military operations; and military space activities. ->Military expenditures data from SIPRI are derived from the NATO definition, which includes all current and capital expenditures on the armed forces, including peacekeeping forces; defense ministries and other government agencies engaged in defense projects; paramilitary forces, if these are judged to be trained and equipped for military operations; and military space activities. Such expenditures include military and civil personnel, including retirement pensions of military personnel and social services for personnel; operation and maintenance; procurement; military research and development; and military aid (in the military expenditures of the donor country). Excluded are civil defense and current expenditures for previous military activities, such as for veterans' benefits, demobilization, conversion, and destruction of weapons. This definition cannot be applied for all countries, however, since that would require much more detailed information than is available about what is included in military budgets and off-budget military expenditure items. (For example, military budgets might or might not cover civil defense, reserves and auxiliary forces, police and paramilitary forces, dual-purpose forces such as military and civilian police, military grants in kind, pensions for military personnel, and social security contributions paid by one part of government to another.)",war_peace
,math_achievement_4th_grade,"Math achievement, 4th grade",measure,,http://spreadsheets.google.com/pub?key=phAwcNAVuyj3Iw3kqbjJTZQ,,"[""linear"", ""log""]",,"TIMSS test score",,"Average score in the international TIMSS test for children in the 4th grade.",achievement
,math_achievement_8th_grade,"Math achievement, 8th grade",measure,,http://spreadsheets.google.com/pub?key=phAwcNAVuyj3fwfA8XA25Eg,,"[""linear"", ""log""]",,"TIMSS test score",,"Average score in the international TIMSS test for childeren in the 8th grade.",achievement
->,ratio_of_girls_to_boys_in_primary_and_secondary_education_perc,"Ratio girls/boys in school",measure,,http://spreadsheets.google.com/pub?key=pyj6tScZqmEcWM3hb0x-BZA,,"[""linear"", ""log""]",,"primary and secondary education, %->primary and secondary education, gross ratio",,"Break in series between 1997 and 1998 due to change from International Standard Classification of Education (ISCED76) to ISCED97. Recent data are provisional. Ratio of girls to boys in primary and secondary education is the percentage of girls to boys enrolled at primary and secondary levels in public and private schools.->Gender parity index for gross enrollment ratio in primary and secondary education is the ratio of girls to boys enrolled at primary and secondary levels in public and private schools.",gender_equality
,ratio_of_young_literate_females_to_males_percent_ages_15_24,"Ratio of young literate females to males",measure,,https://docs.google.com/spreadsheet/pub?key=0AkBd6lyS3EmpdE8xR0dUWDI4ME02SjQ5bi1NYnFHN0E,,"[""linear"", ""log""]",,"%, ages 15-24",,"Ratio of young literate females to males is the percentage of females to males ages 15-24 who can, with understanding, read and write a short, simple statement on their everyday life.",gender_equality
,literacy_rate_adult_female_percent_of_females_ages_15_above,"Literacy of adult females",measure,,http://spreadsheets.google.com/pub?key=pyj6tScZqmEc96gAEE60-Zg,,"[""linear"", ""log""]",,"%, ages 15+",,"Adult literacy rate is the percentage of people ages 15 and above who can, with understanding, read and write a short, simple statement on their everyday life.",literacy
->,co2_intensity_of_economic_output_kg_co2_per_2005_ppp_of_gdp->co2_intensity_of_economic_output_kg_co2_per_2011_ppp_of_gdp,"CO2 intensity of economic output",measure,,https://docs.google.com/spreadsheet/pub?key=0AkBd6lyS3EmpdEVUcEJVRzlFWWRRcjhveGlrQzdwdUE,,"[""linear"", ""log""]",,"kg CO2 per $ of GDP",,"Measures the amount of CO2 (kg) emitted for every dollar of GDP (constant purchasing power parity-adjusted) produced.",emissions
,cumulative_co2_emissions_tonnes,"Cumulative CO2 emissions",measure,,https://github.com/open-numbers/ddf--gapminder--co2_emission,,"[""log"", ""linear""]",,"metric tons",,"Total CO2 emissions from fossil fuel for the period between 1751 and the relevant year in metric tonnes. ",emissions
...,...,...,...,...,...,...,...,...,...,...,...,...
,forest_products_removal_per_ha_dollar,"Forest products removal, per ha",measure,,http://spreadsheets.google.com/pub?key=pp59adS3CHWd9CVdfFx1dEw,,"[""linear"", ""log""]",,$,,"Total annual value of forest products in current USD per hectares, including both wood and non-wood removal during that year.",forestry
->,agricultural_land_percent_of_land_area,"Agricultural land",measure,,https://docs.google.com/spreadsheet/pub?key=0AkBd6lyS3EmpdEF3alRGS0JQZVgwSW1FWUxUQmZoWXc,,"[""linear"", ""log""]",,"% of land area",,"Agricultural land refers to the share of land area that is arable, under permanent crops, and under permanent pastures. Includes land under temporary crops, temporary meadows for mowing or for pasture, land under market or kitchen gardens, and land temporarily fallow. It excludes land under trees grown for wood or timber.->Agricultural land refers to the share of land area that is arable, under permanent crops, and under permanent pastures. Arable land includes land defined by the FAO as land under temporary crops (double-cropped areas are counted once), temporary meadows for mowing or for pasture, land under market or kitchen gardens, and land temporarily fallow. Land abandoned as a result of shifting cultivation is excluded. Land under permanent crops is land cultivated with crops that occupy the land for long periods and need not be replanted after each harvest, such as cocoa, coffee, and rubber. This category includes land under flowering shrubs, fruit trees, nut trees, and vines, but excludes land under trees grown for wood or timber. Permanent pasture is land used for five or more years for forage, including natural and cultivated crops.",geography
->,forest_area_sq_km,"Forest area",measure,,https://docs.google.com/spreadsheet/pub?key=0AkBd6lyS3EmpdFRuaV91Mm9JeUhwR1hHRXJhV3ZBQkE,,"[""linear"", ""log""]",,"sq. km",,"Forest area is land under natural or planted stands of trees, whether productive or not.->Forest area is land under natural or planted stands of trees of at least 5 meters in situ, whether productive or not, and excludes tree stands in agricultural production systems (for example, in fruit plantations and agroforestry systems) and trees in urban parks and gardens.",geography
->,surface_area_sq_km,"Surface area",measure,,https://docs.google.com/spreadsheet/pub?key=0AkBd6lyS3EmpdFFWcWdEM0RXT1lRZ0wwRVNsakZCaWc,,"[""linear"", ""log""]",,"sq. km",,"A country's total area, including areas under inland bodies of water and some coastal waterways.->Surface area is a country's total area, including areas under inland bodies of water and some coastal waterways.",geography
,renewable_water_cu_meters_per_person,"Renewable water",measure,,http://spreadsheets.google.com/pub?key=rPN9VekxwpUzwowMaxg9Ybw,,"[""linear"", ""log""]",,"cu meters per person",,"Actual quantity of renewable water resources per person per year in cubic meters. Renewable water resources refer to the average annual flow of rivers and recharge of groundwater generated from perecipitation, which corresponds to the maximum theoretical yearly amount of water actually available for a country at a given moment. and the resources shared with neighboring countries (geopolitical constraints) have been taken into account. ",environment_water
...,...,...,...,...,...,...,...,...,...,...,...,...
,government_health_spending_per_person_us,"Gov. health spending per person (US$)",measure,,http://spreadsheets.google.com/pub?key=tBwBBkViOJoycBhLnWHqwSQ,,"[""log"", ""linear""]",,,,"The average health expenditure per person that has been paid by government entities during the given year, expressed in US dollars using the average exchange rate.",health_economics
->,medical_doctors_per_1000_people,"Medical Doctors",measure,,http://spreadsheets.google.com/pub?key=phAwcNAVuyj2yo1IzJQmbZg,,"[""linear"", ""log""]",,"per 1 000 people",,"Medical Doctors (physicians) working in any medical field per 1,000 people. ->Physicians include generalist and specialist medical practitioners.",health_economics
,people_living_with_hiv_number_all_ages,"People living with HIV",measure,,http://spreadsheets.google.com/pub?key=pyj6tScZqmEe1GaiYJX2qGA,,"[""log"", ""linear""]",,"total, all ages",,"The total number of persons in all ages that are estimated to be infected by HIV, including those without symptoms, those sick from AIDS and those healthy due to treatment of the HIV infection ",hiv
...,...,...,...,...,...,...,...,...,...,...,...,...
,malaria_deaths_per_100000_reported,"Malaria deaths per 100 000",measure,,http://spreadsheets.google.com/pub?key=pp59adS3CHWfGZUVJ2L-dCw,,"[""linear"", ""log""]",,reported,,"Number of malaria deaths in every 100,000 residents during the given year.",malaria
:,tag,Tag,entity_domain,,,,,,,,,_none
:,parent,"Tag parent",string,,,,,,,,,_none
:,geo,"Geographic location",entity_domain,,https://github.com/open-numbers/ddf--gapminder--dim_geo_countries_and_groups/blob/master/ddf--list--geo--country.csv,,,,,,,_none
:,world_6region,"World Regions (6 colors)",entity_set,geo,http://spreadsheets.google.com/pub?key=phT4mwjvEuGBtdf1ZeO7_PQ,"{""palette"": {""america"": ""#ebcc21"", ""middle_east_north_africa"": ""#5be56b"", ""south_asia"": ""#35d1d1"", ""europe_central_asia"": ""#f49d37"", ""sub_saharan_africa"": ""#4e7af0"", ""east_asia_pacific"": ""#f03838""}, ""selectable"": false}",,,,,,categorizations
:,income_groups,"Income groups",entity_set,geo,http://spreadsheets.google.com/pub?key=phT4mwjvEuGCSmAe5aq7HKw,"{""palette"": {""lower_middle_income"": ""#7ea1d1"", ""upper_middle_income"": ""#a7cb7d"", ""high_income"": ""#7bc135"", ""low_income"": ""#4366f4""}}",,,,,,categorizations
:,landlocked,Landlocked,entity_set,geo,http://spreadsheets.google.com/pub?key=rBwKBodk7Y08pGiA4OAfzUA,"{""palette"": {""coastline"": ""#7487ef"", ""landlocked"": ""#f05656""}}",,,,,,categorizations
:,g77_and_oecd_countries,"G77 and OECD countries",entity_set,geo,http://spreadsheets.google.com/pub?key=tVI_UCwI1enCk4p61fWxUig,"{""palette"": {""g77"": ""#7487ef"", ""others"": ""#f05656"", ""oecd"": ""#71c44c""}}",,,,,,categorizations
:,main_religion_2008,"Main religion 2008",entity_set,geo,http://spreadsheets.google.com/spreadsheet/pub?key=0ArtujvvFrPjVdHUzTGVicFJZQ1NjaFhqelV5SDNxMVE,"{""palette"": {""muslim"": ""#71c44c"", ""eastern_religions"": ""#f05656"", ""christian"": ""#7487ef""}, ""selectable"": false}",,,,,,categorizations
:,country,Country,entity_set,geo,https://github.com/open-numbers/ddf--gapminder--dim_geo_countries_and_groups/blob/master/ddf--list--geo--country.csv,,,"[""world_6region"", ""income_groups"", ""landlocked"", ""g77_and_oecd_countries"", ""main_religion_2008""]",,,,categorizations
:,world_4region,"World Regions",entity_set,geo,http://spreadsheets.google.com/spreadsheet/pub?key=0ArfEDsV3bBwCdHlocWJBM1Uyd1ZPeHduU3c4WGplMEE,"{""palette"": {""asia"": [""#ff5872"", ""#ff5178"", ""#ff658a"", ""#da0025"", ""#fa4e73"", ""#b2043a""], ""africa"": [""#00d5e9"", ""#00c8ec"", ""#00e1ec"", ""#0098df"", ""#77dff7"", ""#0586c6""], ""_default"": [""#ffb600"", ""#ffaa14"", ""#ffc500"", ""#fb6d19"", ""#ffb600"", ""#9b4838""], ""europe"": [""#ffe700"", ""#fbdd00"", ""#fff400"", ""#fbaf09"", ""#ffe700"", ""#b17f4a""], ""americas"": [""#7feb00"", ""#5de200"", ""#81f201"", ""#00b900"", ""#b5ea32"", ""#008d36""]}, ""shades"": {""fill3"": 2, ""fill2"": 1, ""print_fill"": 4, ""print_stroke"": 5, ""fill1"": 0, ""shade"": 3}, ""selectable"": false}",,,,,,categorizations
:,global,World,entity_set,geo,,,,,,,,_none
:,age,Age,measure,,,,"[""linear"", ""log""]",,years,,,_none
:,latitude,Latitude,measure,,https://github.com/open-numbers/ddf--gapminder--dim_geo_countries_and_groups/blob/master/ddf--list--geo--country.csv,,"[""linear""]",,degrees,,,_none
:,longitude,Longitude,measure,,https://github.com/open-numbers/ddf--gapminder--dim_geo_countries_and_groups/blob/master/ddf--list--geo--country.csv,,"[""linear""]",,degrees,,,_none
:,children_per_woman_total_fertility,"Babies per woman",measure,,http://spreadsheets.google.com/pub?key=phAwcNAVuyj0TAlJeCEzcGQ,,"[""linear"", ""log""]",,,,"Total fertility rate. The number of children that would be born to each woman with prevailing age-specific fertility rates. ","_root, newborn_infants"
:,income_per_person_gdppercapita_ppp_inflation_adjusted,"Income per person",measure,,https://github.com/open-numbers/ddf--gapminder--gdp_per_capita_cppp,,"[""log"", ""linear""]",,"GDP/capita in $/year adjusted for inflation & prices",,"Gross domestic product per person adjusted for differences in purchasing power (in international dollars, fixed 2011 prices, PPP based on 2011 ICP).","_root, incomes_growth"
:,co2_emissions_tonnes_per_person,"CO2 per capita",measure,,https://github.com/open-numbers/ddf--gapminder--co2_emission,,"[""log"", ""linear""]",,"metric tons per person",,"Carbon dioxide emissions from the burning of fossil fuels (metric tonnes of CO2 per person). ","_root, emissions"
