@@,concept,name,concept_type,domain,indicator_url,color,scales,drill_up,unit,interpolation,description,tags
:,child_mortality_0_5_year_olds_dying_per_1000_born,"Child mortality rate",measure,,http://spreadsheets.google.com/pub?key=0ArfEDsV3bBwCcGhBd2NOQVZ1eWowNVpSNjl1c3lRSWc,,"[""log"", ""linear""]",,"deaths under age 5 per 1000 births",,"Death of children under five years of age per 1,000 live births ","_root, newborn_infants"
:,gapminder_gini,"Gapminder gini",measure,,https://github.com/open-numbers/ddf--gapminder--gini,,"[""linear""]",,,,,_none
:,life_expectancy_years,"Life expectancy",measure,,https://github.com/open-numbers/ddf--gapminder--life_expectancy,,"[""linear"", ""log""]",,years,,"The average number of years a newborn child would live if current mortality patterns were to stay the same. ","_root, health"
->,extreme_poverty_percent_people_below_125_a_day->extreme_poverty_percent_people_below_190_a_day,"Extreme poverty",measure,,http://spreadsheets.google.com/pub?key=t1YAVXUoD3iJKy2mSq2Padw,,"[""linear"", ""log""]",,"% people below $1.25 a day",,"The percentage of people living on less than $1.25 (2005 purchasing power parity dollars).",poverty_inequality
->,gnipercapita_atlasmethod_current_us,"GNI/capita (Atlas method)",measure,,https://docs.google.com/spreadsheet/pub?key=0ArfEDsV3bBwCdFVrVDZQUnRwZ2lqT2lPMXcySXZwRmc,,"[""log"", ""linear""]",,$,,"GNI per capita, Atlas method (current US$)->GNI per capita (formerly GNP per capita) is the gross national income, converted to U.S. dollars using the World Bank Atlas method, divided by the midyear population. GNI is the sum of value added by all resident producers plus any product taxes (less subsidies) not included in the valuation of output plus net receipts of primary income (compensation of employees and property income) from abroad. GNI, calculated in national currency, is usually converted to U.S. dollars at official exchange rates for comparisons across economies, although an alternative rate is used when the official exchange rate is judged to diverge by an exceptionally large margin from the rate actually applied in international transactions. To smooth fluctuations in prices and exchange rates, a special Atlas method of conversion is used by the World Bank. This applies a conversion factor that averages the exchange rate for a given year and the two preceding years, adjusted for differences in rates of inflation between the country, and through 2000, the G-5 countries (France, Germany, Japan, the United Kingdom, and the United States). From 2001, these countries include the Euro area, Japan, the United Kingdom, and the United States.",incomes_growth
->,gnipercapita_ppp_current_international,"GNI/capita PPP",measure,,https://docs.google.com/spreadsheet/pub?key=0ArfEDsV3bBwCdGhJcHAwanc2aFdZeXl1WTVZQnJjb1E,,"[""log"", ""linear""]",,$,,"GNI per capita, PPP (current international $)->GNI per capita based on purchasing power parity (PPP). PPP GNI is gross national income (GNI) converted to international dollars using purchasing power parity rates. An international dollar has the same purchasing power over GNI as a U.S. dollar has in the United States. GNI is the sum of value added by all resident producers plus any product taxes (less subsidies) not included in the valuation of output plus net receipts of primary income (compensation of employees and property income) from abroad. Data are in current international dollars based on the 2011 ICP round.",incomes_growth
:,inequality_index_gini,"Gini coefficient",measure,,http://spreadsheets.google.com/pub?key=pyj6tScZqmEcjeKHnZq6RIg,,"[""linear"", ""log""]",,,,"Gini index measures the extent to which the distribution of income (or, in some cases, consumption expenditure) among individuals or households within an economy deviates from a perfectly equal distribution. A Lorenz curve plots the cumulative percentages of total income received against the cumulative number of recipients, starting with the poorest individual or household. The Gini index measures the area between the Lorenz curve and a hypothetical line of absolute equality, expressed as a percentage of the maximum area under the line. Thus a Gini index of 0 represents perfect equality, while an index of 100 implies perfect inequality.",poverty_inequality
->,income_share_of_richest_10percent,"Income of richest 10%",measure,,http://spreadsheets.google.com/pub?key=tmKvydPl_roGIQBrMYA6C4g,,"[""linear"", ""log""]",,share,,"Percentage share of income or consumption is the share that accrues to subgroups of population indicated by deciles or quintiles. Percentage shares by quintile may not sum to 100 because of rounding. ->Percentage share of income or consumption is the share that accrues to subgroups of population indicated by deciles or quintiles.",poverty_inequality
->,gnipercapita_constant_2000_us->gnipercapita_constant_2010_us,GNI/capita,measure,,https://docs.google.com/spreadsheet/pub?key=0ArfEDsV3bBwCdFdqZ0NOdjluMmoyUTBTWTRjWWQzQVE,,"[""log"", ""linear""]",,$,,"GNI per capita (constant 2000 US$)",incomes_growth
:,aid_given_2007_us,"Aid given",measure,,http://spreadsheets.google.com/pub?key=tFOn62dEO9QCyIKK6kgSYRQ,,"[""linear"", ""log""]",,$,,"Total amount of allocable aid for official development assistance (ODA) given by the donor countries, expressed in constant 2007 US$.",aid_given
:,aid_given_per_person_2007_us,"Aid given per person",measure,,http://spreadsheets.google.com/pub?key=tGTst0WEm8V8zI9LOYvGmTg,,"[""linear"", ""log""]",,$,,"Total amount of official development assistance (ODA) aid that has been given during this year divided by the population of the country (2007 US$)",aid_given
:,aid_given_percent_of_gni,"Aid given, % of GNI",measure,,http://spreadsheets.google.com/pub?key=tQR7RhlZdPjBkVCDPPF4zUg,,"[""linear"", ""log""]",,,,"Percentage of the gross national income (GNI) of each recepient country that has been given as official development assistance (ODA) aid during this year. ",aid_given
:,water_and_sanitation_aid_given_percent_of_aid,"Water and sanitation aid given",measure,,http://spreadsheets.google.com/pub?key=tXn3DSfvsYujaBP9bvH6acg,,"[""linear"", ""log""]",,"% of aid",,"Percentage of total allocable aid for official development assistance (ODA) given by the donor countries that has been used in water and sanitation.",aid_given
:,economical_infrastructure_aid_given_percent_of_aid,"Economical infrastructure aid given",measure,,http://spreadsheets.google.com/pub?key=tMxqFNS7BC5QyLrhBO8DXqQ,,"[""linear"", ""log""]",,"% of aid",,"Percentage of total allocable aid for official development assistance (ODA) given by the donor countries that has been used in economical infrastructures.",aid_given
:,production_sector_aid_given_percent_of_aid,"Production sector aid given",measure,,http://spreadsheets.google.com/pub?key=tMjW0fdVf9VJaxVk_VFSUhg,,"[""linear"", ""log""]",,"% of aid",,"Percentage of total allocable aid for official development assistance (ODA) given by the donor countries that has been used in production sectors, including agriculture and industry, etc.",aid_given
:,multisector_cross_cutting_aid_given_percent_of_aid,"Multisector cross-cutting aid given",measure,,http://spreadsheets.google.com/pub?key=tBJ1rYQ-nA6fqI6_Gn3mBNg,,"[""linear"", ""log""]",,"% of aid",,"Percentage of total allocable aid for official development assistance (ODA) given by the donor countries that has been used in multisector cross-cutting.",aid_given
:,education_aid_given_percent_of_aid,"Education aid given",measure,,http://spreadsheets.google.com/pub?key=tQQaILpdu-vGtSkJLr2VQCw,,"[""linear"", ""log""]",,"% of aid",,"Percentage of total allocable aid for official development assistance (ODA) given by the donor countries that has been used in education.",aid_given
:,health_aid_given_percent_of_aid,"Health aid given",measure,,http://spreadsheets.google.com/pub?key=tRybjVoG5Ah9yhKcEx16u5Q,,"[""linear"", ""log""]",,"% of aid",,"Percentage of total allocable aid for official development assistance (ODA) given by the donor countries that has been used in health.",aid_given
:,population_policies_aid_given_percent_of_aid,"Population policies aid given",measure,,http://spreadsheets.google.com/pub?key=tjFf_YqwB6tgSG9L0r0Ywdg,,"[""linear"", ""log""]",,"% of aid",,"Percentage of total allocable aid for official development assistance (ODA) given by the donor countries that has been used in population policies/programs and reproductive health.",aid_given
:,government_and_society_aid_given_percent_of_aid,"Government and society aid given",measure,,http://spreadsheets.google.com/pub?key=t3IAEOsfHK-z6rvGLCDR74g,,"[""linear"", ""log""]",,"% of aid",,"Percentage of total allocable aid for official development assistance (ODA) given by the donor countries that has been used in government and civil societies.",aid_given
:,other_social_services_aid_given_percent_of_aid,"Other social services aid given",measure,,http://spreadsheets.google.com/pub?key=tqjUijP4mi_dHKkCZjOn0oA,,"[""linear"", ""log""]",,"% of aid",,"Percentage of total allocable aid for official development assistance (ODA) given by the donor countries that has been used in other social infrastructures and services.",aid_given
->,aid_received_total_us_inflation_adjusted,"Aid received",measure,,https://docs.google.com/spreadsheet/pub?key=0AkBd6lyS3EmpdHVuNVpKdnNCa08yV3NOd0Zsal9JaWc,,"[""linear"", ""log""]",,$,,"The sum of aid each recepient country gets during this year from all donor countries in all sectors, expressed in fixed 2007 US$.->Net official development assistance (ODA) consists of disbursements of loans made on concessional terms (net of repayments of principal) and grants by official agencies of the members of the Development Assistance Committee (DAC), by multilateral institutions, and by non-DAC countries to promote economic development and welfare in countries and territories in the DAC list of ODA recipients. It includes loans with a grant element of at least 25 percent (calculated at a rate of discount of 10 percent). Data are in constant 2012 U.S. dollars.",aid_received
->,aid_received_per_person_current_us,"Aid received per person",measure,,http://spreadsheets.google.com/pub?key=t9GL1nIZdtxszJbjKErN2Hg,,"[""log"", ""linear""]",,$,,"The average amount of aid each person in the recepient country gets during this year from all donor countries in all sectors, expressed in current US$.->Net official development assistance (ODA) per capita consists of disbursements of loans made on concessional terms (net of repayments of principal) and grants by official agencies of the members of the Development Assistance Committee (DAC), by multilateral institutions, and by non-DAC countries to promote economic development and welfare in countries and territories in the DAC list of ODA recipients; and is calculated by dividing net ODA received by the midyear population estimate. It includes loans with a grant element of at least 25 percent (calculated at a rate of discount of 10 percent).",aid_received
->,aid_received_percent_of_gni,"Aid received, % of GNI",measure,,http://spreadsheets.google.com/pub?key=tzK6dx2JltRfVXFI1ADh84w,,"[""linear"", ""log""]",,,,"Percentage of the gross national income (GNI) of each recepient country that comes from official development assistance (ODA) aid during this year. ->Net official development assistance (ODA) consists of disbursements of loans made on concessional terms (net of repayments of principal) and grants by official agencies of the members of the Development Assistance Committee (DAC), by multilateral institutions, and by non-DAC countries to promote economic development and welfare in countries and territories in the DAC list of ODA recipients. It includes loans with a grant element of at least 25 percent (calculated at a rate of discount of 10 percent).",aid_received
:,dollar_billionaires_per_million_people,"Dollar billionaires per million",measure,,http://spreadsheets.google.com/pub?key=tAQpQeQkuyA1-ZovdDJ7JAw,,"[""log"", ""linear""]",,,,"Number of billionaires among every 1 million people in the country of their citizenship, calculation based on data from Forbes.com",poverty_inequality
:,average_age_of_dollar_billionaires_years,"Average age of $ billionaires",measure,,http://spreadsheets.google.com/pub?key=t_KhYe1qTGh4c90N61AUDSg,,"[""linear"", ""log""]",,years,,"The average age of billionaires in the country of their citizenship, calculation based on data from Forbes.com",poverty_inequality
:,total_number_of_dollar_billionaires,"Dollar billionaires",measure,,http://spreadsheets.google.com/pub?key=tNWhbu-1UIPPxtmRHtnINOQ,,"[""linear"", ""log""]",,,,"Total number of billionaires in the country of their citizenship, provided by Forbes.com",poverty_inequality
->,debt_to_foreigners_by_public_and_private_percent_of_gni,"Debt to foreigners",measure,,https://docs.google.com/spreadsheet/pub?key=0AkBd6lyS3EmpdDlSTTVWUkU3Z254aEhERmVuQWZaeWc,,"[""linear"", ""log""]",,"public & private, % of GNI",,"External debt, total (% of GNI)->Total external debt stocks to gross national income. Total external debt is debt owed to nonresidents repayable in currency, goods, or services. Total external debt is the sum of public, publicly guaranteed, and private nonguaranteed long-term debt, use of IMF credit, and short-term debt. Short-term debt includes all debt having an original maturity of one year or less and interest in arrears on long-term debt. GNI (formerly GNP) is the sum of value added by all resident producers plus any product taxes (less subsidies) not included in the valuation of output plus net receipts of primary income (compensation of employees and property income) from abroad.",debt_trade
->,total_reserves_percent_of_debt_to_foreigners,"Total reserves",measure,,https://docs.google.com/spreadsheet/pub?key=0AkBd6lyS3EmpdC1iMVRuVUFUd08tVDM0ZDF0cnFtekE,,"[""linear"", ""log""]",,"% of debt to foreigners",,"Total reserves (% of external debt)->International reserves to total external debt stocks.",debt_trade
->,total_gdp_us_inflation_adjusted,"Total GDP",measure,,http://spreadsheets.google.com/pub?key=pyj6tScZqmEfI4sLVvEQtHw,,"[""log"", ""linear""]",,$,,"Total GDP (constant exchange rate US$)->GDP at purchaser's prices is the sum of gross value added by all resident producers in the economy plus any product taxes and minus any subsidies not included in the value of the products. It is calculated without making deductions for depreciation of fabricated assets or for depletion and degradation of natural resources. Data are in constant 2010 U.S. dollars. Dollar figures for GDP are converted from domestic currencies using 2010 official exchange rates. For a few countries where the official exchange rate does not reflect the rate effectively applied to actual foreign exchange transactions, an alternative conversion factor is used.",incomes_growth
->,gdppercapita_us_inflation_adjusted,GDP/capita,measure,,https://docs.google.com/spreadsheet/pub?key=0AkBd6lyS3EmpdHo5S0J6ekhVOF9QaVhod05QSGV4T3c,,"[""log"", ""linear""]",,$,,"GDP per capita in exchange rate terms and adjusted for inflation (2000 US$)->GDP per capita is gross domestic product divided by midyear population. GDP is the sum of gross value added by all resident producers in the economy plus any product taxes and minus any subsidies not included in the value of the products. It is calculated without making deductions for depreciation of fabricated assets or for depletion and degradation of natural resources. Data are in constant 2010 U.S. dollars.",incomes_growth
:,gdpperemployee_us_inflation_adjusted,GDP/employee,measure,,http://spreadsheets.google.com/pub?key=rcTO3doih5lvJCjgLSvlajA,,"[""log"", ""linear""]",,$,,"The average Gross Domestic Products per each employee during the given year, counted by constant 1990 US$.",incomes_growth
:,gdpperworking_hour_us_inflation_adjusted,"GDP/working hour",measure,,http://spreadsheets.google.com/pub?key=r6kTHMinnVedj8gPsUtfZ0g,,"[""log"", ""linear""]",,$,,"The average Gross Domestic Products per hour per person, counted by constant 1990 US$.",incomes_growth
:,gdppercapita_growth_over_next_10_years,"GDP/capita growth over next 10 years",measure,,http://spreadsheets.google.com/pub?key=tvllZwGIbhwxLD7EXFhPeXQ,,"[""linear"", ""log""]",,,,"Average growth in GDP per capita over the subsequent 10 years, i.e. the data for 1980 concerns the average growth 1980-90. The data is based on income per person v12. Projections after 2005.",incomes_growth
->,gdppercapita_growth_percent_per_year,"GDP/capita growth",measure,,https://docs.google.com/spreadsheet/pub?key=0AkBd6lyS3EmpdEdDWHhBcFpjMUo4MGE2X2Q4WXFQRGc,,"[""linear"", ""log""]",,"% per year",,"Annual growth in GDP pc. Based on World Bank data.->Annual percentage growth rate of GDP per capita based on constant local currency. Aggregates are based on constant 2010 U.S. dollars. GDP per capita is gross domestic product divided by midyear population. GDP at purchaser's prices is the sum of gross value added by all resident producers in the economy plus any product taxes and minus any subsidies not included in the value of the products. It is calculated without making deductions for depreciation of fabricated assets or for depletion and degradation of natural resources.",alternative_gdp_data
->,total_gni_ppp_current_international,"Total GNI",measure,,https://docs.google.com/spreadsheet/pub?key=0ArfEDsV3bBwCdFl6cDkxcmZxM0pVNXBUYjE1ZmNqVUE,,"[""log"", ""linear""]",,"PPP, current international $",,"PPP GNI (formerly PPP GNP) is gross national income converted to international dollars using purchasing power parity rates. An international dollar has the same purchasing power over GNI as a U.S. dollar has in the United States.->PPP GNI (formerly PPP GNP) is gross national income (GNI) converted to international dollars using purchasing power parity rates. An international dollar has the same purchasing power over GNI as a U.S. dollar has in the United States. Gross national income is the sum of value added by all resident producers plus any product taxes (less subsidies) not included in the valuation of output plus net receipts of primary income (compensation of employees and property income) from abroad. Data are in current international dollars. For most economies PPP figures are extrapolated from the 2011 International Comparison Program (ICP) benchmark estimates or imputed using a statistical model based on the 2011 ICP. For 47 high- and upper middle-income economies conversion factors are provided by Eurostat and the Organisation for Economic Co-operation and Development (OECD).",incomes_growth
->,income_share_of_richest_20percent,"Income of richest 20%",measure,,http://spreadsheets.google.com/pub?key=tLnCxItXzRSu9gH-5PyEFDw,,"[""linear"", ""log""]",,share,,"Percentage share of income or consumption is the share that accrues to subgroups of population indicated by deciles or quintiles. Percentage shares by quintile may not sum to 100 because of rounding. ->Percentage share of income or consumption is the share that accrues to subgroups of population indicated by deciles or quintiles. Percentage shares by quintile may not sum to 100 because of rounding.",poverty_inequality
->,income_share_of_2nd_richest_20percent,"Income of 2nd richest 20%",measure,,http://spreadsheets.google.com/pub?key=twSOUYrIFh2W2snDUt7VaQg,,"[""linear"", ""log""]",,share,,"Percentage share of income or consumption is the share that accrues to subgroups of population indicated by deciles or quintiles. Percentage shares by quintile may not sum to 100 because of rounding. ->Percentage share of income or consumption is the share that accrues to subgroups of population indicated by deciles or quintiles. Percentage shares by quintile may not sum to 100 because of rounding.",poverty_inequality
->,income_share_of_middle_20percent,"Income of middle 20%",measure,,http://spreadsheets.google.com/pub?key=t_-14NtXH6xZX48xHG75z5w,,"[""linear"", ""log""]",,share,,"Percentage share of income or consumption is the share that accrues to subgroups of population indicated by deciles or quintiles. Percentage shares by quintile may not sum to 100 because of rounding. ->Percentage share of income or consumption is the share that accrues to subgroups of population indicated by deciles or quintiles. Percentage shares by quintile may not sum to 100 because of rounding.",poverty_inequality
->,income_share_of_2nd_poorest_20percent,"Income of 2nd poorest 20%",measure,,http://spreadsheets.google.com/pub?key=tXRyZGCfHsWMmr53VFxrqTw,,"[""linear"", ""log""]",,share,,"Percentage share of income or consumption is the share that accrues to subgroups of population indicated by deciles or quintiles. Percentage shares by quintile may not sum to 100 because of rounding. ->Percentage share of income or consumption is the share that accrues to subgroups of population indicated by deciles or quintiles. Percentage shares by quintile may not sum to 100 because of rounding.",poverty_inequality
->,income_share_of_poorest_20percent,"Income of poorest 20%",measure,,http://spreadsheets.google.com/pub?key=pyj6tScZqmEdIyrBS31XAaw,,"[""linear"", ""log""]",,share,,"Percentage share of income or consumption is the share that accrues to subgroups of population indicated by deciles or quintiles. Percentage shares by quintile may not sum to 100 because of rounding. ->Percentage share of income or consumption is the share that accrues to subgroups of population indicated by deciles or quintiles. Percentage shares by quintile may not sum to 100 because of rounding.",poverty_inequality
->,income_share_of_poorest_10percent,"Income of poorest 10%",measure,,http://spreadsheets.google.com/pub?key=trzLWJQU4SZMDpeVg3XnL5A,,"[""linear"", ""log""]",,share,,"Percentage share of income or consumption is the share that accrues to subgroups of population indicated by deciles or quintiles. Percentage shares by quintile may not sum to 100 because of rounding. ->Percentage share of income or consumption is the share that accrues to subgroups of population indicated by deciles or quintiles.",poverty_inequality
:,inflation_annual_percent,Inflation,measure,,https://docs.google.com/spreadsheet/pub?key=0AkBd6lyS3EmpdGJoOUJXalk3STFYUG85MkxlbnQxMmc,,"[""linear"", ""log""]",,"annual %",,"Inflation as measured by the annual growth rate of the GDP implicit deflator shows the rate of price change in the economy as a whole. The GDP implicit deflator is the ratio of GDP in current local currency to GDP in constant local currency.",economic_situation
:,central_bank_discount_rate_annual_percent,"Central bank discount rate",measure,,http://spreadsheets.google.com/pub?key=pyj6tScZqmEejn8qHNmm4LQ,,"[""linear"", ""log""]",,"annual %",,"Central bank discount rate (annual %)",economic_situation
->,investments_percent_of_gdp,Investments,measure,,https://docs.google.com/spreadsheet/pub?key=0AkBd6lyS3EmpdG9sVVF6dHpGdnhQU3BkMlAtNHFwVkE,,"[""linear"", ""log""]",,"% of GDP",,"Outlays on additions to the fixed assets of the economy plus net changes in the level of inventories. Fixed assets include land improvements (fences, ditches, drains, and so on); plant, machinery, and equipment purchases; and the construction of roads, railways, and the like, including schools, offices, hospitals, private residential dwellings, and commercial and industrial buildings. Inventories are stocks of goods held by firms to meet temporary or unexpected fluctuations in production or sales, and ""work in progress"".->Gross capital formation (formerly gross domestic investment) consists of outlays on additions to the fixed assets of the economy plus net changes in the level of inventories. Fixed assets include land improvements (fences, ditches, drains, and so on); plant, machinery, and equipment purchases; and the construction of roads, railways, and the like, including schools, offices, hospitals, private residential dwellings, and commercial and industrial buildings. Inventories are stocks of goods held by firms to meet temporary or unexpected fluctuations in production or sales, and ""work in progress."" According to the 1993 SNA, net acquisitions of valuables are also considered capital formation.",economic_situation
:,tax_revenue_percent_of_gdp,"Tax revenue",measure,,https://docs.google.com/spreadsheet/pub?key=0AkBd6lyS3EmpdFgzT1ZJWW4tdDB4Q2NETTVoTG1ZYlE,,"[""linear"", ""log""]",,"% of GDP",,"Tax revenue refers to compulsory transfers to the central government for public purposes. Certain compulsory transfers such as fines, penalties, and most social security contributions are excluded. Refunds and corrections of erroneously collected tax revenue are treated as negative revenue.",economic_situation
->,foreign_direct_investment_net_inflows_percent_of_gdp,"Foreign investment inflows",measure,,https://docs.google.com/spreadsheet/pub?key=0AkBd6lyS3EmpdE03VFhRMnBpMGZhQ19Vbk9pMGU5VUE,,"[""linear"", ""log""]",,"direct, % of GDP",,"Net inflows of investment to acquire a lasting management interest (10 percent or more of voting stock) in an enterprise operating in an economy other than that of the investor. It is the sum of equity capital, reinvestment of earnings, other long-term capital, and short-term capital as shown in the balance of payments, as a percentage of GDP.->Foreign direct investment are the net inflows of investment to acquire a lasting management interest (10 percent or more of voting stock) in an enterprise operating in an economy other than that of the investor. It is the sum of equity capital, reinvestment of earnings, other long-term capital, and short-term capital as shown in the balance of payments. This series shows net inflows (new investment inflows less disinvestment) in the reporting economy from foreign investors, and is divided by GDP.",economic_situation
