@@,concept,name,concept_type,domain,indicator_url,color,scales,drill_up,unit,interpolation,description,tags
->,foreign_direct_investment_net_outflows_percent_of_gdp,"Foreign investment outflows",measure,,https://docs.google.com/spreadsheet/pub?key=0AkBd6lyS3EmpdHQtSzBhVXA2WTNrVDFleUZvZ0doTUE,,"[""linear"", ""log""]",,"direct, % of GDP",,"Net outflows of investment to acquire a lasting management interest (10 percent or more of voting stock) in an enterprise operating in an economy other than that of the investor. It is the sum of equity capital, reinvestment of earnings, other long-term capital, and short-term capital as shown in the balance of payments, as a percentage of GDP.->Foreign direct investment refers to direct investment equity flows in an economy. It is the sum of equity capital, reinvestment of earnings, and other capital. Direct investment is a category of cross-border investment associated with a resident in one economy having control or a significant degree of influence on the management of an enterprise that is resident in another economy. Ownership of 10 percent or more of the ordinary shares of voting stock is the criterion for determining the existence of a direct investment relationship. This series shows net outflows of investment from the reporting economy to the rest of the world, and is divided by GDP.",economic_situation
:,patent_applications_total,"Patent applications",measure,,http://spreadsheets.google.com/pub?key=pyj6tScZqmEd5FA9xlfO9eA,,"[""linear"", ""log""]",,total,,"Patents are documents issued by a government office that describe an invention and create a legal situation in which the patented invention can normally be exploited only by or with the authorization of the patent holder. The protection is generally limited to 20 years. ",economic_situation
:,patents_granted_total,"Patents granted",measure,,http://spreadsheets.google.com/pub?key=pyj6tScZqmEdMioz5VJKXHw,,"[""linear"", ""log""]",,total,,"Patents are documents issued by a government office that describe an invention and create a legal situation in which the patented invention can normally be exploited only by or with the authorization of the patent holder. The protection is generally limited to 20 years. ",economic_situation
:,patents_in_force_total,"Patents in force",measure,,http://spreadsheets.google.com/pub?key=pyj6tScZqmEe371ZVZl73eA,,"[""linear"", ""log""]",,total,,"Patents are documents issued by a government office that describe an invention and create a legal situation in which the patented invention can normally be exploited only by or with the authorization of the patent holder. The protection is generally limited to 20 years. ",economic_situation
:,iso3166_1_alpha2,"ISO 3166-1 alpha-2",string,,http://www.iso.org/iso/home/standards/country_codes.htm,,,,,,,_none
:,iso3166_1_alpha3,"ISO 3166-1 alpha-3",string,,http://www.iso.org/iso/home/standards/country_codes.htm,,,,,,,_none
:,iso3166_1_numeric,"ISO 3166-1 numeric",string,,http://www.iso.org/iso/home/standards/country_codes.htm,,,,,,,_none
:,iso3166_2,"ISO 3166-2",string,,https://en.wikipedia.org/wiki/ISO_3166-2,,,,,,,_none
:,literacy_rate_adult_male_percent_of_males_ages_15_and_above,"Literacy of adult males",measure,,http://spreadsheets.google.com/pub?key=pyj6tScZqmEd4fn4YYOvuOg,,"[""linear"", ""log""]",,"%, ages 15+",,"Adult literacy rate is the percentage of people ages 15 and above who can, with understanding, read and write a short, simple statement on their everyday life.",literacy
:,literacy_rate_adult_total_percent_of_people_ages_15_and_above,"Literacy of adults",measure,,http://spreadsheets.google.com/pub?key=pyj6tScZqmEdrsBnj2ROXAg,,"[""linear"", ""log""]",,"%, ages 15+",,"Adult literacy rate is the percentage of people ages 15 and above who can, with understanding, read and write a short, simple statement on their everyday life.",literacy
:,literacy_rate_youth_female_percent_of_females_ages_15_24,"Literacy of youth females",measure,,http://spreadsheets.google.com/pub?key=pyj6tScZqmEf96wv_abR0OA,,"[""linear"", ""log""]",,"%, ages 15-24",,"Youth literacy rate is the percentage of people ages 15-24 who can, with understanding, read and write a short, simple statement on their everyday life.",literacy
:,literacy_rate_youth_male_percent_of_males_ages_15_24,"Literacy of youth males",measure,,http://spreadsheets.google.com/pub?key=pyj6tScZqmEe7OxrqKcSWfw,,"[""linear"", ""log""]",,"%, ages 15-24",,"Youth literacy rate is the percentage of people ages 15-24 who can, with understanding, read and write a short, simple statement on their everyday life.",literacy
:,literacy_rate_youth_total_percent_of_people_ages_15_24,"Literacy of youth",measure,,http://spreadsheets.google.com/pub?key=pyj6tScZqmEepmgV0TLjBag,,"[""linear"", ""log""]",,"%, ages 15-24",,"Youth literacy rate is the percentage of people ages 15-24 who can, with understanding, read and write a short, simple statement on their everyday life.",literacy
->,children_out_of_school_primary,"Children out of primary school",measure,,https://docs.google.com/spreadsheet/pub?key=0AkBd6lyS3EmpdGVSdkZnZWhfMDYybzd6U2p3NkxsZ3c,,"[""linear"", ""log""]",,,,"Break in series between 1997 and 1998 due to change from International Standard Classification of Education (ISCED76) to ISCED97. Recent data are provisional. Children out of school are the number of primary-school-age children not enrolled in primary or secondary school.->Children out of school are the number of primary-school-age children not enrolled in primary or secondary school.",school_enrolment
->,children_out_of_school_primary_female,"Children out of primary school, female",measure,,https://docs.google.com/spreadsheet/pub?key=0AkBd6lyS3EmpdFNPaEhiUDJ0QWZYOEwwQlBSTmtza1E,,"[""linear"", ""log""]",,,,"Break in series between 1997 and 1998 due to change from International Standard Classification of Education (ISCED76) to ISCED97. Recent data are provisional. Children out of school are the number of primary-school-age children not enrolled in primary or secondary school.->Children out of school are the number of primary-school-age children not enrolled in primary or secondary school.",school_enrolment
->,children_out_of_school_primary_male,"Children out of primary school, male",measure,,https://docs.google.com/spreadsheet/pub?key=0AkBd6lyS3EmpdFd5cnQzNU5IYm1vTWtrTWRIX3UxbHc,,"[""linear"", ""log""]",,,,"Break in series between 1997 and 1998 due to change from International Standard Classification of Education (ISCED76) to ISCED97. Recent data are provisional. Children out of school are the number of primary-school-age children not enrolled in primary or secondary school.->Children out of school are the number of primary-school-age children not enrolled in primary or secondary school.",school_enrolment
->,primary_completion_rate_total_percent_of_relevant_age_group,"Primary school completion",measure,,https://docs.google.com/spreadsheet/pub?key=0AkBd6lyS3EmpdEhTN2hlZ05ZczVwZDdVZlF5cUxJb2c,,"[""linear"", ""log""]",,"% of relevant age group",,"Primary completion rate is the percentage of students completing the last year of primary school. It is calculated by taking the total number of students in the last grade of primary school, minus the number of repeaters in that grade, divided by the total number of children of official graduation age.->Primary completion rate, or gross intake ratio to the last grade of primary education, is the number of new entrants (enrollments minus repeaters) in the last grade of primary education, regardless of age, divided by the population at the entrance age for the last grade of primary education. Data limitations preclude adjusting for students who drop out during the final year of primary education.",school_enrolment
->,primary_school_completion_percent_of_boys,"Primary school completion: boys",measure,,https://docs.google.com/spreadsheet/pub?key=0AkBd6lyS3EmpdGhCWnZrTGMwaTl5ek9QS0szMTIwcEE,,"[""linear"", ""log""]",,%,,"Completion rate in primary schooling for boys (percent of boys). ->Primary completion rate, or gross intake ratio to the last grade of primary education, is the number of new entrants (enrollments minus repeaters) in the last grade of primary education, regardless of age, divided by the population at the entrance age for the last grade of primary education. Data limitations preclude adjusting for students who drop out during the final year of primary education.",school_enrolment
->,primary_school_completion_percent_of_girls,"Primary school completion: girls",measure,,https://docs.google.com/spreadsheet/pub?key=0AkBd6lyS3EmpdFVxSEVZVWE1b0l6NWo5NzNTZ2IzWVE,,"[""linear"", ""log""]",,%,,"Completion rate in primary schooling for girls (percent of girls). ->Primary completion rate, or gross intake ratio to the last grade of primary education, is the number of new entrants (enrollments minus repeaters) in the last grade of primary education, regardless of age, divided by the population at the entrance age for the last grade of primary education. Data limitations preclude adjusting for students who drop out during the final year of primary education.",school_enrolment
->,expenditure_per_student_primary_percent_of_gdp_per_person,"Expenditure per student, primary",measure,,https://docs.google.com/spreadsheet/pub?key=0AkBd6lyS3EmpdFJTUEVleTM0cE5jTnlTMk41ajBGclE,,"[""linear"", ""log""]",,"% of GDP/capita",,"Break in series between 1997 and 1998 due to change from International Standard Classification of Education (ISCED76) to ISCED97. Recent data are provisional. Public expenditure per student is the public current spending on education divided by the total number of students by level, as a percentage of GDP per person. Public expenditure (current and capital) includes government spending on educational institutions (both public and private), education administration as well as subsidies for private entities (students/households and other privates entities).->Government expenditure per student is the average general government expenditure (current, capital, and transfers) per student in the given level of education, expressed as a percentage of GDP per capita.",schooling_cost
->,expenditure_per_student_secondary_percent_of_gdp_per_person,"Expenditure per student, secondary",measure,,https://docs.google.com/spreadsheet/pub?key=0AkBd6lyS3EmpdDBuUVIzbWwtaU5helpJVG5BMmxyX1E,,"[""linear"", ""log""]",,"% of GDP/capita",,"Break in series between 1997 and 1998 due to change from International Standard Classification of Education (ISCED76) to ISCED97. Recent data are provisional. Public expenditure per student is the public current spending on education divided by the total number of students by level, as a percentage of GDP per person. Public expenditure (current and capital) includes government spending on educational institutions (both public and private), education administration as well as subsidies for private entities (students/households and other privates entities).->Government expenditure per student is the average general government expenditure (current, capital, and transfers) per student in the given level of education, expressed as a percentage of GDP per capita.",schooling_cost
->,expenditure_per_student_tertiary_percent_of_gdp_per_person,"Expenditure per student, tertiary",measure,,https://docs.google.com/spreadsheet/pub?key=0AkBd6lyS3EmpdDJxdlN6cEtYMjMxdC1XdGdKOXR2bkE,,"[""linear"", ""log""]",,"% of GDP/capita",,"Break in series between 1997 and 1998 due to change from International Standard Classification of Education (ISCED76) to ISCED97. Recent data are provisional. Public expenditure per student is the public current spending on education divided by the total number of students by level, as a percentage of GDP per person. Public expenditure (current and capital) includes government spending on educational institutions (both public and private), education administration as well as subsidies for private entities (students/households and other privates entities).->Government expenditure per student is the average general government expenditure (current, capital, and transfers) per student in the given level of education, expressed as a percentage of GDP per capita.",schooling_cost
:,mean_years_in_school_women_25_years_and_older,"Mean years in school, women 25+",measure,,http://spreadsheets.google.com/pub?key=0ArfEDsV3bBwCdHFEVVhHZElzb0VRWE9pc3JmZHg2dWc,,"[""linear"", ""log""]",,,,"The average number of years of school attended by all people in the age and gender group specified, including primary, secondary and tertiary education. ",mean_years_in_school
:,mean_years_in_school_men_25_years_and_older,"Mean years in school, men 25+",measure,,http://spreadsheets.google.com/pub?key=0ArfEDsV3bBwCdC03X1ZWNGJHR3FBb0Q3VjJIdV9OSmc,,"[""linear"", ""log""]",,,,"The average number of years of school attended by all people in the age and gender group specified, including primary, secondary and tertiary education. ",mean_years_in_school
:,mean_years_in_school_women_25_to_34_years,"Mean years in school, women 25-34",measure,,http://spreadsheets.google.com/pub?key=0ArfEDsV3bBwCdC1MYzAtY2xPQ2xOR1lMeGhYSWlpR0E,,"[""linear"", ""log""]",,,,"The average number of years of school attended by all people in the age and gender group specified, including primary, secondary and tertiary education. ",mean_years_in_school
:,mean_years_in_school_men_25_to_34_years,"Mean years in school, men 25-34",measure,,http://spreadsheets.google.com/pub?key=0ArfEDsV3bBwCdHlYZHNWN1YtWVNudU9UbWJOd19nUVE,,"[""linear"", ""log""]",,,,"The average number of years of school attended by all people in the age and gender group specified, including primary, secondary and tertiary education. ",mean_years_in_school
:,mean_years_in_school_women_of_reproductive_age_15_to_44,"Mean years in school, women 15-44",measure,,http://spreadsheets.google.com/pub?key=0ArfEDsV3bBwCdEttYjNNUTlkUTdrMUQ0c3BTR0dINlE,,"[""linear"", ""log""]",,,,"The average number of years of school attended by all people in the age and gender group specified, including primary, secondary and tertiary education. ",mean_years_in_school
:,mean_years_in_school_women_percent_men_25_to_34_years,"Mean years in school, women/men, 25-34",measure,,http://spreadsheets.google.com/pub?key=0ArfEDsV3bBwCdG5JUDZjTHR5SzZFZjBqa2JYYUxBclE,,"[""linear"", ""log""]",,%,,"The ratio of female to male number of years in school, among 25- to 34-year-olds, including primary, secondary and tertiary education. ",mean_years_in_school
:,energy_use_total,"Energy use",measure,,https://docs.google.com/spreadsheet/pub?key=0AkBd6lyS3EmpdHd2Nld0NEVFOGRiSTc0V3ZoekNuS1E,,"[""linear"", ""log""]",,"tons in oil eqv",,"Energy use refers to use of primary energy before transformation to other end-use fuels, which is equal to indigenous production plus imports and stock changes, minus exports and fuels supplied to ships and aircraft engaged in international transport, counted in tonnes of oil equivalent (toe).",total
->,energy_use_per_person,"Energy use per person",measure,,https://docs.google.com/spreadsheet/pub?key=0AkBd6lyS3EmpdHRmYjJWLVF0SjlQY1N5Vm9yU0xxaGc,,"[""linear"", ""log""]",,"tons in oil eqv->KG in oil eqv",,"Energy use refers to use of primary energy before transformation to other end-use fuels, which is equal to indigenous production plus imports and stock changes, minus exports and fuels supplied to ships and aircraft engaged in international transport, counted in tonnes of oil equivalent (toe).->Energy use refers to use of primary energy before transformation to other end-use fuels, which is equal to indigenous production plus imports and stock changes, minus exports and fuels supplied to ships and aircraft engaged in international transport.",total
:,energy_production_total,"Energy production",measure,,https://docs.google.com/spreadsheet/pub?key=0AkBd6lyS3EmpdFNZMXZwcjNPY2c3MWwxbWIwVFgyd0E,,"[""linear"", ""log""]",,"tons in oil eqv",,"Energy production refers to forms of primary energy--petroleum (crude oil, natural gas liquids, and oil from nonconventional sources), natural gas, solid fuels (coal, lignite, and other derived fuels), and combustible renewables and waste--and primary electricity, all converted into tonnes of oil equivalents, counted in tonnes of oil equivalent (toe).",total
:,energy_production_per_person,"Energy production per person",measure,,https://docs.google.com/spreadsheet/pub?key=0AkBd6lyS3EmpdHJ6UTV4MkEyN0NYdnJJOG1oYUxmTWc,,"[""linear"", ""log""]",,"tons in oil eqv",,"Energy production refers to forms of primary energy--petroleum (crude oil, natural gas liquids, and oil from nonconventional sources), natural gas, solid fuels (coal, lignite, and other derived fuels), and combustible renewables and waste--and primary electricity, all converted into tonnes of oil equivalents, calculated by dividing with the population of each country during the given year, counted in tonnes of oil equivalent (toe).",total
->,pump_price_for_gasoline_us_per_liter,"Pump price for gasoline",measure,,http://spreadsheets.google.com/pub?key=pyj6tScZqmEdz8B4njtoHPA,,"[""linear"", ""log""]",,$/liter,,"Fuel prices refer to the pump prices of the most widely sold grade of gasoline. ->Fuel prices refer to the pump prices of the most widely sold grade of gasoline. Prices have been converted from the local currency to U.S. dollars.",energy
:,coal_consumption_total,"Coal consumption",measure,,http://spreadsheets.google.com/pub?key=0Auk0ddvGIrGqcHlqNnRTY1pxbUVjMVRtTWlGZG1PVmc,,"[""linear"", ""log""]",,"tons in oil eqv",,"Total amount of coal consumption (tonnes oil equivalent)",coal
:,coal_consumption_per_cap,"Coal consumption per person",measure,,http://spreadsheets.google.com/pub?key=0Auk0ddvGIrGqcHlqNnRTY1pxbUVka1hObHlPbTlmUUE,,"[""linear"", ""log""]",,"tons in oil eqv",,"Coal consumption per person (tonnes oil equivalent)",coal
->,electricity_use_per_person,"Electricity use per person",measure,,http://spreadsheets.google.com/pub?key=tiVeyAJd7iRWorOwl_ARWEQ,,"[""linear"", ""log""]",,kWh,,"The amount of electricity consumed per person during the given year, counted in kilowatt-hours (kWh).->Electric power consumption measures the production of power plants and combined heat and power plants less transmission, distribution, and transformation losses and own use by heat and power plants.",electricity
:,electricity_use_total,"Electricity use",measure,,http://spreadsheets.google.com/pub?key=tEu78F4acf0u6MRyhg5-9qQ,,"[""linear"", ""log""]",,kWh,,"The total amount of electricity consumed during the given year, counted in kilowatt-hours (kWh).",electricity
:,residential_electricity_use_per_person,"Residential electricity use per person",measure,,http://spreadsheets.google.com/pub?key=t7SFNscT9Ex0s9i3av7PxRQ,,"[""linear"", ""log""]",,kWh,,"The amount of residential electricity consumed per person during the given year, counted in kilowatt-hours (kWh).",electricity
:,residential_electricity_use_total,"Residential electricity use",measure,,http://spreadsheets.google.com/pub?key=teUZEfKw52HewO3D0YrQ5HA,,"[""linear"", ""log""]",,kWh,,"The total amount of residential electricity consumed during the given year, counted in kilowatt-hours (kWh).",electricity
:,electricity_generation_total,"Electricity generation",measure,,http://spreadsheets.google.com/pub?key=pyj6tScZqmEehRG-9mMHYdg,,"[""linear"", ""log""]",,kWh,,"Electricity generation (kilowatt-hours)",electricity
:,electricity_generation_per_person,"Electricity generation per person",measure,,http://spreadsheets.google.com/pub?key=pyj6tScZqmEeMtYNdMyLKOw,,"[""log"", ""linear""]",,kWh,,"Electricity generation per person (kilowatt-hours)",electricity
:,hydro_power_generation_total,"Hydro electricity production",measure,,http://spreadsheets.google.com/pub?key=t1MShlv870O6LmFNEHazdEg,,"[""linear"", ""log""]",,"tons in oil eqv",,"The amount of hydro power generated during the given year, counted in tonnes of oil equivalent (toe).",hydro
:,hydro_power_generation_per_person,"Hydro electricity production per person",measure,,http://spreadsheets.google.com/pub?key=tSjVrGemv30eCh3jPZkXYCQ,,"[""linear"", ""log""]",,"tons in oil eqv",,"The amount of hydro power generated per person during the given year, counted in tonnes of oil equivalent (toe).",hydro
:,nuclear_power_generation_total,"Nuclear electricity production",measure,,http://spreadsheets.google.com/pub?key=trRb8ZIaBOD4KzikShshZ2g,,"[""linear"", ""log""]",,"tons in oil eqv",,"The amount of electricity produced by nuclear power plants in a given year, counted in tonnes of oil equivalent (toe).",nuclear
:,nuclear_power_generation_per_person,"Nuclear electricity production per person",measure,,http://spreadsheets.google.com/pub?key=t28UhT9IaWINamciSiJIS7w,,"[""linear"", ""log""]",,"tons in oil eqv",,"The amount of electricity produced by nuclear power plants per person in a given year, counted in tonnes of oil equivalent (toe).",nuclear
:,natural_gas_production_total,"Natural gas production",measure,,http://spreadsheets.google.com/pub?key=pyj6tScZqmEfv2K6dZmskWg,,"[""linear"", ""log""]",,"tons in oil eqv",,"Natural gas production (tonnes oil equivalent)",natural_gas
:,natural_gas_production_per_person,"Natural gas production per person",measure,,http://spreadsheets.google.com/pub?key=pyj6tScZqmEf0IBo_AGrgKA,,"[""log"", ""linear""]",,"tons in oil eqv",,"Natural gas production per person (tonnes oil equivalent)",natural_gas
:,natural_gas_proven_reserves_per_person,"Natural gas proven reserves per person",measure,,http://spreadsheets.google.com/pub?key=pyj6tScZqmEfZd6DbNF1MKA,,"[""log"", ""linear""]",,"tons in oil eqv",,"Natural gas proven reserves per person (tonnes oil equivalent)",natural_gas
:,natural_gas_proved_reserves_total,"Natural gas proved reserves",measure,,http://spreadsheets.google.com/pub?key=pyj6tScZqmEc5qiv87tr3NA,,"[""linear"", ""log""]",,"tons in oil eqv",,"Proven reserves of natural gas (tonnes oil equivalent)",natural_gas
:,oil_production_per_person,"Oil production per person",measure,,http://spreadsheets.google.com/pub?key=pyj6tScZqmEeUgUuvuJTONQ,,"[""linear"", ""log""]",,tons,,"Crude oil production per person (tonnes oil equivalent)",oil
:,oil_production_total,"Oil production",measure,,http://spreadsheets.google.com/pub?key=pyj6tScZqmEdNIa3ckVXaCQ,,"[""linear"", ""log""]",,tons,,"Total amount of crude oil production (tonnes oil equivalent)",oil
:,oil_proven_reserves_per_person,"Oil proven reserves per person",measure,,http://spreadsheets.google.com/pub?key=pyj6tScZqmEfrI4YlDJDUag,,"[""log"", ""linear""]",,tons,,"Oil proven reserves per person (tonnes oil equivalent)",oil
:,oil_proved_reserves_total,"Oil proved reserves",measure,,http://spreadsheets.google.com/pub?key=pyj6tScZqmEfJfS1WYrLeBA,,"[""linear"", ""log""]",,tons,,"Proven reserves of oil (tonnes oil equivalent)",oil
:,oil_consumption_total,"Oil consumption",measure,,http://spreadsheets.google.com/pub?key=pyj6tScZqmEcm0fIa0IVtKw,,"[""linear"", ""log""]",,tons,,"Total amount of crude oil consumption (tonnes oil equivalent)",oil
:,oil_consumption_per_cap,"Oil consumption per person",measure,,http://spreadsheets.google.com/pub?key=0ArfEDsV3bBwCdERNZmlfUGM5YVE3bmEwODdlRDFqSkE,,"[""linear"", ""log""]",,tons,,"Oil Consumption per capita (tonnes per year per person)",oil
:,drought_deaths_annual_number,"Drought deaths",measure,,http://spreadsheets.google.com/pub?key=rvRwTPi0n_94EScVA3YjLeg,,"[""linear"", ""log""]",,annual,,"Number of people killed in drought during the given year.",disasters
:,earthquake_deaths_annual_number,"Earthquake deaths",measure,,http://spreadsheets.google.com/pub?key=rvbbs7uxQc7swJ4RR2BcQfA,,"[""linear"", ""log""]",,annual,,"Number of people killed in earthquake during the given year.",disasters
:,epidemic_deaths_annual_number,"Epidemic deaths",measure,,http://spreadsheets.google.com/pub?key=rvtZF_JC0OI27tL66o6hiMQ,,"[""linear"", ""log""]",,annual,,"Number of people killed in epidemic during the given year.",disasters
:,extreme_temperature_deaths_annual_number,"Extreme temperature deaths",measure,,http://spreadsheets.google.com/pub?key=r4WUTsck3NfccM6UsKlGF7g,,"[""linear"", ""log""]",,annual,,"Number of people killed in extreme temperature during the given year.",disasters
:,flood_deaths_annual_number,"Flood deaths",measure,,http://spreadsheets.google.com/pub?key=rtESPUlrTyLEoHpURqE8RAg,,"[""linear"", ""log""]",,annual,,"Number of people killed in flood during the given year.",disasters
:,storm_deaths_annual_number,"Storm deaths",measure,,http://spreadsheets.google.com/pub?key=r0JePjBgBQqtuh5wh1Wz9CA,,"[""linear"", ""log""]",,annual,,"Number of people killed in storm during the given year.",disasters
:,tsunami_deaths_annual_number,"Tsunami deaths",measure,,http://spreadsheets.google.com/pub?key=rdBew79hTeXcIXhB1VCTPfg,,"[""linear"", ""log""]",,annual,,"Number of people killed in tsunami during the given year.",disasters
:,plane_crash_deaths_annual_number,"Plane crash deaths",measure,,http://spreadsheets.google.com/pub?key=rSv5aMDwESiKg-yA__-tRFg,,"[""linear"", ""log""]",,annual,,"Number of people killed in air accidents during the given year.",disasters
:,drought_affected_annual_number,"Drought affected",measure,,http://spreadsheets.google.com/pub?key=rAYA0bjnfYwzXnir0cigijQ,,"[""linear"", ""log""]",,annual,,"Total number of people getting affected, injured or killed in drought during the given year.",disasters
:,earthquake_affected_annual_number,"Earthquake affected",measure,,http://spreadsheets.google.com/pub?key=rG_BjsDwyS2n7DANNH3i5vQ,,"[""linear"", ""log""]",,annual,,"Total number of people getting affected, injured or killed in earthquake during the given year.",disasters
:,epidemic_affected_annual_number,"Epidemic affected",measure,,http://spreadsheets.google.com/pub?key=r6H8dfVPu2CJ2nzI8X0jurw,,"[""linear"", ""log""]",,annual,,"Total number of people getting affected, injured or killed in epidemic during the given year.",disasters
